Habitación Sencilla ,Teléfono,CONCEPTO,I.V.A. ,Impuestos sobre hospedaje,Página web,Dirección,Estrellas
774.0,(442) 214-3535 y 214-3099,HOTEL MIRABEL ,0.16,0.025,www.hotelmirabel.com.mx,"Constituyentes 2 Ote. Centro, cp. 76000 Querétaro, Qro. ",****
970.52,(442) 103 3900,HOTELES CITY EXPRESS SUITES,0.16,0.025,https://www.cityexpress.com/,"Av. 5 de Febrero No. 9200, Col Parque Industrial Benito Juárez, 76100 Santiago de Querétaro, Qro.",****
789.0,(442) 192-3900,PLAZA CAMELINAS HOTEL,0.16,0.025,www.plazacamelinas.com.mx,"Av. 5 de Febrero 28, La Capilla, 76170 Santiago de Querétaro, Qro.",*****
995.0,(442) 251 8900,HOTEL REAL ALAMEDA,0.16,0.025,http://www.hotelrealalameda.com/,"Corregidora Sur no. 184-D, Col. Centro, Querétaro, Qro. ",****
1030.0,(442) 234-0000 Ext. 547,HOTEL MISION JURIQUILLA ,0.16,0.025,http://www.hotelesmision.com.mx/queretaro_juriquilla.php,"Blvd. Villas del Mesón No. 56, Juriquilla Querétaro. C.P. 76230",*****
1150.0,(4429 103-3030,FOUR POINTS BY SHERATON,0.16,0.035,http://www.starwoodhotels.com/fourpoints/index.html,"Carretera a San Luis Potosí No. 13001, Col. Jurica, C.P. 76127",*****
920.0,(442) 690-9400,RAMADA ENCORE HOTEL QRO.,0.16,0.035,www.hotelesencore.com,"Paseo de la República 11515, Juriquilla, Qro. C.P. 76230",****
990.0,"(442) 251-9800, 224-1985 y 224-1986.",HOTEL QUINTA SANTIAGO,0.16,0.025,http://www.hotelquintasantiago.mx/,"Andrés Balvanera no. 4, Centro Histórico, Querétaro, Qro. ",****
1150.0,(442) 368 3030,HOME 2 BY HILTON,0.16,0.035,http://www.hiltonhotels.com/,"Carret. Querétaro -San Luis Potosí 631-C, Jurica, 76100 Santiago de Querétaro, Qro.",*****
