original_title,title_length,production_companies
(500) Days of Summer,20," Watermark, Fox Searchlight Pictures,  Dune Entertainment III"
"10,000 BC",9," The Department of Trade and Industry of South Africa,  Moonlighting Films,  Warner Bros., Centropolis Entertainment,  Legendary Pictures"
102 Dalmatians,14," Cruella Productions, Walt Disney Pictures"
12 Rounds,9," WWE Studios,  Fox Atomic,  20th Century Fox Home Entertainment, The Mark Gordon Company,  Midnight Sun Pictures"
12 Years a Slave,16," Regency Enterprises,  River Road Entertainment,  New Regency Pictures,  Film4, Plan B Entertainment"
127 Hours,9,"Fox Searchlight Pictures,  Dune Entertainment,  Cloud Eight Films,  Warner Bros.,  Darlow Smithson Productions"
13 Going On 30,14,"Columbia Pictures,  Thirteen Productions,  Revolution Studios"
1408,4,Dimension Films
15 Minutes,10," Industry Entertainment, New Line Cinema,  Tribeca Productions,  New Redemption Pictures"
16 Blocks,9," Nu Image Entertainment GmbH,  Millennium Films, Donners' Company,  Cheyenne Enterprises,  Alcon Entertainment"
17 Again,8," Offspring Entertainment, New Line Cinema"
2 Fast 2 Furious,16,"Mikona Productions GmbH & Co. KG,  Ardustry Entertainment,  Universal Pictures,  Original Film"
2 Guns,6,"Universal Studios,  Marc Platt Productions,  Envision Entertainment Corporation,  Emmett/Furla Films"
2012,4," The Mark Gordon Company,  Farewell Productions, Columbia Pictures,  Centropolis Entertainment"
21,2,"Columbia Pictures,  Relativity Media"
21 & Over,9," Mandeville Films,  Virgin Produced, Relativity Media,  SkyLand Entertainment"
21 Grams,8," Y Productions,  Mediana Productions Filmgesellschaft, This Is That Productions"
21 Jump Street,14," Metro-Goldwyn-Mayer (MGM), Columbia Pictures,  Relativity Media,  Original Film,  Stephen J. Cannell Productions"
22 Jump Street,14," Original Film,  Media Rights Capital, Columbia Pictures,  Cannell Studios,  Metro-Goldwyn-Mayer (MGM)"
27 Dresses,10," Dune Entertainment III,  Fox 2000 Pictures, Spyglass Entertainment"
28 Days Later...,16,"DNA Films,  British Film Council"
28 Weeks Later,14," Figment Films,  Fox Atomic,  UK Film Council,  Sociedad General de Cine S.A., DNA Films"
3 Idiots,8,Vidhu Vinod Chopra Productions
30 Days of Night,16," HorrorFlix,  Dark Horse Entertainment,  Ghost House Pictures, Columbia Pictures"
30 Minutes or Less,18,Columbia Pictures
300,3," Hollywood Gang Productions, Virtual Studios,  Legendary Pictures,  Atmosphere Entertainment MM,  Warner Bros."
3000 Miles to Graceland,23," Morgan Creek Productions,  Warner Bros., Franchise Pictures"
300: Rise of an Empire,22," Hollywood Gang Productions, Legendary Pictures,  Nimar Studios,  Atmosphere Entertainment MM,  Warner Bros."
3:10 to Yuma,12,"Tree Line Films,  Yuma,  Relativity Media,  Lionsgate"
42,2,Warner Bros.
47 Ronin,8," H2F Entertainment,  Universal,  Stuber Productions, Mid Atlantic Films,  Moving Picture Company (MPC)"
4: Rise of the Silver Surfer,28," 1492 Pictures,  Constantin Film Produktion,  Twentieth Century Fox Film Corporation,  Dune Entertainment, Ingenious Film Partners"
50 First Dates,14," Anonymous Content, Columbia Pictures Corporation,  Flower Films (II),  Happy Madison Productions"
50/50,5,"Summit Entertainment,  Mandate Pictures"
8 Mile,6,"Imagine Entertainment,  Mikona Productions GmbH & Co. KG"
88 Minutes,10," Brightlight Pictures,  Nu Image Entertainment, TriStar Pictures"
9,1," Starz Animation,  Relativity Media, Focus Films,  Tim Burton Productions,  Arc Productions"
A Beautiful Mind,16," DreamWorks SKG,  Universal Pictures, Imagine Entertainment"
A Christmas Carol,17,"Walt Disney,  ImageMovers"
A Cinderella Story,18," Dylan Sellers Productions,  Clifford Werber Productions,  Warner Bros., Gaylord Films"
A Dangerous Method,18,"Recorded Pictures Company,  The Movie Network,  Millbrook Pictures,  Prospero Pictures,  Lago Film"
A Good Day to Die Hard,22,"Ingenious Media,  Mid Atlantic Films,  Twentieth Century Fox Film Corporation,  Dune Entertainment,  Big Screen Productions"
A Good Year,11," Scott Free Productions, Fox 2000 Pictures"
A Guy Thing,11," David Ladd Films, Metro-Goldwyn-Mayer (MGM)"
A History of Violence,21," BenderSpink,  DC Comics, New Line Cinema"
A Knight's Tale,15,"Columbia Pictures Corporation,  Finestkind,  Escape Artists,  Black and Blu Entertainment"
A Lot Like Love,15," Beacon Pictures,  Touchstone Pictures,  Kevin Messick Productions, Mile High Productions"
A Man Apart,11," Newman/Tooley Films,  ""DIA"" Productions GmbH & Co. KG, New Line Cinema,  Joseph Nittolo Entertainment"
A Mighty Heart,14," Paramount Vantage, Plan B Entertainment,  Revolution Films"
A Mighty Wind,13,Castle Rock Entertainment
A Most Violent Year,19," FilmNation Entertainment,  Washington Square Films,  Imagenation Abu Dhabi FZ, Participant Media,  Before the Door Pictures"
A Nightmare on Elm Street,25,"New Line Cinema,  Platinum Dunes"
A Perfect Getaway,17," Rogue,  Tooley Productions, Davis Entertainment,  Relativity Media,  QED International"
A Scanner Darkly,16," Warner Independent Pictures (WIP), Thousand Words,  Section Eight Productions,  Detour Filmproduction"
A Serious Man,13," Relativity Media, Mike Zoss Productions,  Studio Canal,  Focus Features,  Working Title Films"
A Sound of Thunder,18," Franchise Pictures,  Baldwin Entertainment Group,  Dante Entertainment,  Crusader Entertainment, Epsilon Motion Pictures"
A Thousand Words,16," DreamWorks SKG, Paramount Pictures,  Saturn Films,  Varsity Pictures"
A Very Harold & Kumar Christmas,31," Mandate Pictures, New Line Cinema"
A Walk Among the Tombstones,27,"Double Feature Films,  Exclusive Media Group,  Jersey Films,  Cross Creek Pictures,  1984 Private Defense Contractors"
A Walk in the Woods,19," Route One Films, Wildwood Enterprises"
A Walk to Remember,18," Warner Bros., Pandora Pictures"
A.I. Artificial Intelligence,28," Amblin Entertainment,  Warner Bros.,  Stanley Kubrick Productions, DreamWorks SKG"
AVP: Alien vs. Predator,23," Stillking Films, Impact Pictures,  Davis Entertainment,  Twentieth Century Fox Film Corporation,  Studio Babelsberg"
Abandon,7," Spyglass Entertainment, Paramount Pictures,  Touchstone Pictures"
Abduction,9," Tailor Made,  Mango Farms,  Gotham Group,  Vertigo Entertainment, Lions Gate Films"
About Last Night,16,"Screen Gems,  Rainforest Films,  Inc.,  Olive Bridge Entertainment"
About Schmidt,13," Avery Pix, New Line Cinema"
About a Boy,11,Universal Pictures
Abraham Lincoln: Vampire Hunter,31," Location Gourmet,  Tim Burton Productions, Bazelevs Production,  Abraham Productions"
Accepted,8," Shady Acres Entertainment, Universal Pictures"
Act of Valor,12," Bandito Brothers, Relativity Media"
Action Replayy,14," Hari Om Entertainment Co., PVR Cinemas,  Blockbuster Movie Entertainers"
Adaptation.,11," Clinica Estetico,  Propaganda Films, Columbia Pictures,  Intermedia,  Beverly Detroit"
Admission,9,Focus Features
Adventureland,13," This Is That Productions, Miramax Films,  Sidney Kimmel Entertainment"
After Earth,11,"Columbia Pictures,  Blinding Edge Pictures,  Overbrook Entertainment"
Agent Cody Banks,16," Metro-Goldwyn-Mayer (MGM),  Madacy Entertainment,  Dylan Sellers Productions,  Maverick Films, Splendid Pictures"
Agent Cody Banks 2: Destination London,38," Dylan Sellers Productions, Splendid Pictures,  Madacy Entertainment,  Metro-Goldwyn-Mayer (MGM),  Maverick Films"
Agora,5," Mod Producciones,  Canal+ España,  Nimar Studios,  Telecinco Cinema, Himenóptero"
Akeelah and the Bee,19," 2929 Productions,  Out of the Blue... Entertainment,  Starbucks Entertainment,  Cinema Gypsy Productions, Lions Gate Films"
Albert Nobbs,12,Chrysalis Films
Alex & Emma,11," Reiner-Greisman,  Franchise Pictures,  Escape Artists, Epsilon Motion Pictures"
Alex Cross,10,Summit Entertainment
Alexander,9," Warner Bros.,  Pathé Renn Productions, France 3 Cinéma,  Intermedia Films,  Egmond Film & Television"
"Alexander and the Terrible, Horrible, No Good, Very Bad Day",59," Jim Henson Company,  21 Laps Entertainment,  The, Walt Disney Pictures"
Alfie,5,"Paramount Pictures,  Patalex Productions"
Ali,3,Columbia Pictures Corporation
Alice in Wonderland,19," Team Todd,  Zanuck Company,  The,  Tim Burton Productions,  Roth Films, Walt Disney Pictures"
Aliens in the Attic,19," Upstairs Canada Productions,  Josephson Entertainment,  New Upstairs Productions, Twentieth Century Fox Film Corporation,  Regency Enterprises"
All About Steve,15," Dune Entertainment III, Dune Entertainment,  Fortis Films,  Radar Pictures,  Fox 2000 Pictures"
All About the Benjamins,23,New Line Cinema
All Is Lost,11," FilmNation Entertainment, Sudden Storm Productions,  Before the Door Pictures,  Washington Square Films,  Treehouse Pictures"
All the King's Men,18," Relativity Media,  VIP 4 Medienfonds, Columbia Pictures Corporation,  Rising Star,  Phoenix Pictures"
Almost Famous,13," Vinyl Films,  DreamWorks Pictures, Columbia Pictures"
Aloha,5," Regency Enterprises,  Vinyl Films,  RatPac Entertainment, Columbia Pictures,  Sony Pictures Entertainment (SPE)"
Alone in the Dark,17," Herold Productions,  Lionsgate, Boll Kino Beteiligungs GmbH & Co. KG,  Brightlight Pictures,  Infogrames Entertainment"
Along Came Polly,16,"Universal Pictures,  Jersey Films,  Loofah Productions"
Along Came a Spider,19," David Brown Productions,  Phase 1 Productions,  MFP Munich Film Partners,  AZL Productions KG, Paramount Pictures"
Alpha and Omega,15," Crest Animation Productions, Lions Gate Family Entertainment,  Relativity Media"
Alvin and the Chipmunks,23," Regency Enterprises, Dune Entertainment,  Fox 2000 Pictures,  Bagdasarian Productions"
Alvin and the Chipmunks: Chipwrecked,36,Fox 2000 Pictures
Alvin and the Chipmunks: The Squeakquel,39,"Regency Enterprises,  Fox 2000 Pictures,  Bagdasarian Productions"
American Dreamz,15,"Universal Pictures,  Depth of Field"
American Gangster,17," Universal Pictures,  Film Rites,  Relativity Media, Imagine Entertainment,  Scott Free Productions"
American Hustle,15,"Columbia Pictures,  Annapurna Pictures,  Atlas Entertainment"
American Outlaws,16,"Warner Bros. Pictures,  Morgan Creek Productions"
American Pie 2,14," Liveplanet, Universal Pictures,  Zide-Perry Productions"
American Psycho,15," Muse Productions,  Edward R. Pressman Film, Lions Gate Films"
American Reunion,16,Universal Pictures
American Sniper,15," Malpaso Productions,  Warner Bros., Village Roadshow Pictures,  Mad Chance Productions,  RatPac-Dune Entertainment"
American Wedding,16," LivePlanet,  Loumolo & Co., Universal Pictures,  Zide-Perry Productions"
An Education,12,BBC Films
An Unfinished Life,18,"Miramax Films,  Persistent Entertainment,  Revolution Studios,  Initial Entertainment Group (IEG),  The Ladd Company"
Anchorman 2: The Legend Continues,33," Apatow Productions, Paramount Pictures,  Gary Sanchez Productions"
Anchorman: The Legend of Ron Burgundy,37,Apatow Productions
Angel Eyes,10,"Warner Bros. Pictures,  Morgan Creek Productions,  Franchise Pictures"
Angels & Demons,15,"Columbia Pictures,  Skylark Productions,  Panorama Films,  Imagine Entertainment"
Anger Management,16," Happy Madison Productions, Columbia Pictures,  Revolution Studios"
Annabelle,9," Evergreen Media Group,  The Safran Company, New Line Cinema,  RatPac-Dune Entertainment"
Annapolis,9,Touchstone Pictures
Annie,5," Sony Pictures Entertainment (SPE), Columbia Pictures,  Overbrook Entertainment"
Ant-Man,7,Marvel Studios
AntiTrust,9,"Industry Entertainment,  Epsilon Motion Pictures,  Hyde Park Films,  Metro-Goldwyn-Mayer (MGM)"
Antwone Fisher,14,Fox Searchlight
Apocalypto,10,"Icon Productions,  Touchstone Pictures,  Icon Entertainment International"
Apollo 18,9," Bekmambetov Projects Ltd.,  Dimension Films, Bazelevs Production"
Aquamarine,10," Storefront Pictures, Fox 2000 Pictures"
Arbitrage,9," Artina Films, Lionsgate,  Lucky Monkey Pictures,  Green Room Films,  Treehouse Pictures"
Are We There Yet?,17," Revolution Studios, Columbia Pictures,  Cube Vision"
Argo,4,"GK Films,  Warner Bros.,  Smokehouse Pictures"
Armored,7," Farah Films & Management, Screen Gems,  Stars Road Entertainment,  Buckaroo Entertainment"
Around the World in 80 Days,27," Babelsberg Film,  80 Days Productions, Studio Babelsberg,  Mostow/Lieberman Productions,  Walden Media"
Arthur,6,Warner Bros.
"As Above, So Below",18,Legendary Pictures
Assault on Precinct 13,22," Liaison Films,  Biscayne Pictures,  Why Not Productions, Rogue Pictures"
Astro Boy,9," Summit Entertainment,  Imagi Animation Studios,  Tezuka Production Company Ltd., The Weinstein Company"
Atlantis: The Lost Empire,25,"Walt Disney Pictures,  Walt Disney Feature Animation"
Atlas Shrugged Part I,21,Atlas Productions
Atonement,9,"Universal Pictures,  Working Title Films,  Studio Canal,  Relativity Media"
Attack the Block,16,"UK Film Council,  Film4,  Studio Canal"
August Rush,11," CJ Entertainment,  Southpaw Entertainment, Warner Bros."
August: Osage County,20,"Jean Doumanian Productions,  Smokehouse Pictures"
Austin Powers in Goldmember,27," Gratitude International,  Eric's Boy,  Moving Pictures, New Line Cinema,  Team Todd"
Australia,9," ScreenWest,  Dune Entertainment III,  Twentieth Century Fox Film Corporation, Bazmark Films,  Ingenious Film Partners"
Auto Focus,10," Propaganda Films,  Good Machine, Sony Pictures Classics"
Avatar,6," Lightstorm Entertainment,  Twentieth Century Fox Film Corporation, Ingenious Film Partners,  Dune Entertainment"
Avengers: Age of Ultron,23,"Marvel Studios,  Revolution Sun Studios,  Prime Focus"
Awake,5,"The Weinstein Company,  Open City Films,  GreeneStreet Films"
Babel,5," Central Films,  Anonymous Content, Paramount Vantage,  Media Rights Capital"
Baby Boy,8,Columbia Pictures
Baby Mama,9,"Relativity Media,  Michaels-Goldwyn"
Babylon A.D.,12," Canal+, StudioCanal,  Babylon,  CinéCinéma,  M6 Films"
Bad Boys II,11," Don Simpson/Jerry Bruckheimer Films, Columbia Pictures Corporation"
Bad Company,11,"Jerry Bruckheimer Films,  Touchstone Pictures,  Stillking Films"
Bad News Bears,14,Paramount Pictures
Bad Santa,9,"Columbia Pictures,  Dimension Films (US version)"
Bad Teacher,11,"Columbia Pictures,  Mosaic Media Group"
Baggage Claim,13,Sneak Preview Productions
Bandits,7," Epsilon Motion Pictures,  Hyde Park Entertainment,  Metro-Goldwyn-Mayer (MGM),  Empire Pictures, Cheyenne Enterprises"
Bandslam,8," Goldsmith-Thomas Productions, Summit Entertainment,  Walden Media"
Bangkok Dangerous,17," International Production Company, Virtual Studios,  Saturn Films,  Blue Star Pictures,  Initial Entertainment Group"
Banlieue 13,11," EuropaCorp, Canal Plus,  TF1 Films Production"
Barbershop,10,Metro-Goldwyn-Mayer (MGM)
Barbershop 2:  Back in Business,31,Metro-Goldwyn-Mayer (MGM)
Barney's Version,16,Serendipity Point Films
Barnyard,8,"Paramount Pictures,  Paramount Animation,  Nickelodeon Movies"
Basic,5," Krane Entertainment, Intermedia Films"
Basic Instinct 2,16," IMF Internationale Medien und Film GmbH & Co. 3. Produktions KG, Intermedia Films,  C-2 Pictures,  Kanzaman"
Batman Begins,13," Warner Bros.,  DC Entertainment,  Syncopy, DC Comics,  Legendary Pictures"
Battle of the Year,18,Screen Gems
Battle: Los Angeles,19," Original Film, Columbia Pictures,  Relativity Media"
Battleship,10," Bluegrass Films,  Film 44, Universal Pictures,  Hasbro"
Be Cool,7," Jersey Films,  Nina Saxon Film Design,  Metro-Goldwyn-Mayer (MGM), Double Feature Films"
Beastly,7," Storefront Films, CBS Films,  Mel's Cite du Cinema"
Beauty Shop,11,Metro-Goldwyn-Mayer (MGM)
Because of Winn-Dixie,21,Twentieth Century Fox Film Corporation
Becoming Jane,13," 2 Entertain,  Bueprint Pictures, Ecosse Films"
Bedazzled,9," KirchMedia, Twentieth Century Fox Film Corporation,  Regency Enterprises"
Bedtime Stories,15," Gunn Films,  Happy Madison Productions, Walt Disney Pictures"
Bee Movie,9,"Pacific Data Images (PDI),  DreamWorks Animation,  Columbus 81 Productions"
Before the Devil Knows You're Dead,34," Funky Buddha Productions, Capitol Films,  Linsefilm,  Michael Cerenzie Productions,  Unity Productions"
Begin Again,11," Exclusive Media Group,  Sycamore Pictures,  Apatow Productions, Likely Story"
Behind Enemy Lines,18," Davis Entertainment, Twentieth Century Fox Film Corporation"
Behind the Candelabra,21,HBO Films
Belle,5," British Film Institute (BFI),  DJ Films, Isle of Man Film,  Pinewood Studios,  Metrol Technology"
Beowulf,7," Shangri-La Entertainment,  Paramount Animation, Paramount Pictures,  ImageMovers"
Beverly Hills Chihuahua,23,Walt Disney Pictures
Bewitched,9,"Columbia Pictures Corporation,  Red Wagon Entertainment,  Bewitched"
Big Eyes,8,"The Weinstein Company,  Silverwood Films,  Electric City Entertainment,  Tim Burton Productions"
Big Fat Liar,12,Universal Pictures
Big Fish,8," Tim Burton Productions, The Zanuck Company,  Jinks/Cohen Company,  Columbia Pictures Corporation"
Big Hero 6,10,"Walt Disney Pictures,  Walt Disney Animation Studios"
Big Miracle,11," Anonymous Content,  Working Title Films, Universal Pictures"
Big Momma's House,17," Regency Enterprises, Twentieth Century Fox Film Corporation"
Big Momma's House 2,19," Deep River Productions,  Regency Enterprises,  Epsilon Motion Pictures,  Firm Films, Twentieth Century Fox Film Corporation"
"Big Mommas: Like Father, Like Son",33," New Regency Pictures,  Runteldat Entertainment,  The Collective Studios, Twentieth Century Fox Film Corporation,  Regency Enterprises"
Big Trouble,11,Touchstone Pictures
Billy Elliot,12," Tiger Aspect Productions,  StudioCanal, BBC Films,  Working Title Films,  Arts Council of England"
Birdman,7," New Regency Pictures,  M Productions,  Le Grisbi Productions,  TSG Entertainment, Worldview Entertainment"
Black Christmas,15,Dimension Films
Black Hawk Down,15,"Jerry Bruckheimer Films,  Revolution Studios,  Scott Free Productions"
Black Mass,10," RatPac-Dune Entertainment,  Cross Creek Pictures,  Head Gear Films,  Free State Pictures, Infinitum Nihil"
Black Nativity,14," Fox Searchlight, Fox Searchlight Pictures"
Black Snake Moan,16,Paramount Classics
Black Swan,10,"Fox Searchlight Pictures,  Cross Creek Pictures,  Protozoa Pictures,  Dune Entertainment"
Black or White,14,Treehouse Pictures
Blackhat,8," Forward Pass, Universal Pictures,  Legendary Pictures"
Blade II,8," Imaginary Forces,  Milk & Honey,  Amen Ra Films, New Line Cinema,  Marvel Entertainment,  LLC"
Blade: Trinity,14," Amen Ra Films,  Imaginary Forces,  Shawn Danielle Productions Ltd., New Line Cinema,  Marvel Enterprises"
Blended,7,"Happy Madison Productions,  Gulfstream Pictures,  Karz Entertainment,  Warner Bros."
Blood Diamond,13," Warner Bros., Bedford Falls Productions,  Virtual Studios,  Lonely Film Productions GmbH & Co. KG.,  Spring Creek Productions"
Blood Ties,10," Canal+,  LGM Productions, Wild Bunch,  Mars Distribution,  Les Productions du Trésor"
Blood Work,10," Warner Bros. Pictures, Malpaso Productions"
BloodRayne,10,Boll KG
Blow,4,New Line Cinema
Blue Crush,10," Universal Pictures, Imagine Entertainment,  Shutt/Jones Productions,  Mikona Productions GmbH & Co. KG"
Blue Jasmine,12,Perdido Productions
Boat Trip,9," Artisan Entertainment, Motion Picture Corporation of America"
Body of Lies,12,"Scott Free Productions,  De Line Pictures,  Warner Bros."
Boiler Room,11,New Line Cinema
Bolt,4,"Walt Disney Pictures,  Walt Disney Animation Studios"
Bones,5,New Line Cinema
Boogeyman,9," Senator International, Ghost House Pictures,  Pacific Renaissance Pictures Ltd.,  Screen Gems"
Borat: Cultural Learnings of America for Make Benefit Glorious Nation of Kazakhstan,83," Four By Two Productions, Twentieth Century Fox Film Corporation"
Boys and Girls,14,Dimension Films
Brave,5," Pixar Animation Studios, Walt Disney Pictures"
Brick Mansions,14," Ciné+,  D8, Canal+,  EuropaCorp"
Bride Wars,10," Dune Entertainment III,  New Regency Pictures, Dune Entertainment,  Fox 2000 Pictures,  Regency Enterprises"
Brideshead Revisited,20," HanWay Films,  Ecosse Films,  UK Film Council,  2 Entertain, BBC Films"
Bridesmaids,11,"Universal Pictures,  Relativity Media,  Apatow Productions"
Bridge of Spies,15," Studio Babelsberg,  Marc Platt Productions,  Fox 2000 Pictures, DreamWorks SKG,  Amblin Entertainment"
Bridge to Terabithia,20," Hal Lieberman Company, Walden Media,  Lauren Levine Productions Inc."
Bridget Jones's Diary,21," Universal Pictures,  Working Title Films,  Studio Canal, Miramax Films,  Little Bird"
Bridget Jones: The Edge of Reason,33,"Miramax Films,  Atlantic Television,  Studio Canal,  Universal Pictures,  Working Title Films"
Bright Star,11," Australian Film Finance Corporation (AFFC),  Screen Australia,  Pathé Renn Productions, BBC Films,  UK Film Council"
Bring It On,11,Beacon Communications
Bringing Down The House,23," Touchstone Pictures, Hyde Park Films"
Brokeback Mountain,18,"River Road Entertainment,  Good Machine,  Alberta Film Entertainment,  Focus Features"
Broken City,11," Closest to the Hole Productions, Regency Enterprises,  New Regency Pictures,  1984 Private Defense Contractors,  Inferno International"
Broken Flowers,14," Five Roses,  Focus Features, Bac Films"
Brooklyn,8," Parallel Film Productions,  Irish Film Board,  Item 7, Wildgaze Films"
Brooklyn's Finest,17," Thunder Road Productions,  Langley Productions, Nu Image Films,  Fuqua Films,  Millennium Films"
Brothers,8," Palomar Pictures (II),  Michael De Luca Productions,  Relativity Media, Lionsgate,  Sighvatsson Films"
Bruce Almighty,14," Spyglass Entertainment, Universal Pictures,  Pit Bull Productions,  Shady Acres Entertainment"
Bullet to the Head,18," Silver Reel,  After Dark Films,  IM Global, Dark Castle Entertainment,  Automatik Entertainment"
Burke & Hare,12," Aegis Film Fund,  Quickfire Films,  Fragile Films,  Prescience, Ealing Studios"
Burlesque,9,Bedford Falls Productions
Burn After Reading,18," Focus Features, Mike Zoss Productions,  Working Title Films,  Relativity Media,  Studio Canal"
Burnt,5," PeaPie Films,  3 Arts Entertainment, Double Feature Films"
Cake,4," Cinelou Films,  We're Not Brothers Productions, Echo Films"
Calendar Girls,14," Touchstone Pictures, Harbour Pictures"
Capitalism: A Love Story,24,"The Weinstein Company,  Paramount Vantage"
Capote,6,"Sony Pictures Classics,  Province of British Columbia Production Services Tax Credit,  Eagle Vision Inc.,  Manitoba Film and Video Production Tax Credit,  Cooper's Town Productions"
Captain America: The First Avenger,34,Marvel Studios
Captain America: The Winter Soldier,35,Marvel Studios
Captain Phillips,16,Columbia Pictures
Captivity,9," RAMCO, Foresight Unlimited,  Captivity Productions"
Carnage,7,"Wild Bunch,  Canal+,  CinéCinéma,  Zanagar Films,  Constantin Film Produktion"
Carol,5,"Killer Films,  Number 9 Films,  Film4"
Carrie,6,"Screen Gems,  Metro-Goldwyn-Mayer (MGM),  Misher Films"
Cars,4," Pixar Animation Studios, Walt Disney Pictures"
Cars 2,6," Pixar Animation Studios, Walt Disney Pictures"
Case 39,7," Anonymous Content, Paramount Vantage,  Case 39 Productions,  Misher Films"
Casino Royale,13,Eon Productions
Cast Away,9," Playtone,  ImageMovers,  Twentieth Century Fox Film Corporation, DreamWorks SKG"
Catch Me If You Can,19,"DreamWorks SKG,  Kemp Company,  Splendid Pictures"
Catch and Release,17," Relativity Media, Columbia Pictures Corporation"
Cats & Dogs,11," Zide-Perry Productions,  NPV Entertainment,  Mad Chance, Village Roadshow Pictures,  Warner Bros."
Cats & Dogs 2 : The Revenge of Kitty Galore,43,Village Roadshow Pictures
Catwoman,8," Warner Bros., Village Roadshow Pictures,  Maple Shade Films,  DiNovi Pictures,  Frantic Films"
Cellular,8,New Line Cinema
Centurion,9," Canal+,  Celador Films,  UK Film Council, Pathé Pictures International,  Warner Bros."
Changeling,10,"Imagine Entertainment,  Malpaso Productions,  Relativity Media"
Changing Lanes,14,Paramount Pictures
Chappie,7," Sony Pictures Entertainment (SPE),  Alpha Core,  Genre Films, Columbia Pictures,  Media Rights Capital"
Charlie St. Cloud,17," Marc Platt Productions,  Relativity Media, Universal Pictures"
Charlie Wilson's War,20," Participant Productions,  Playtone Production, Universal Pictures"
Charlie and the Chocolate Factory,33," Tim Burton Productions, Village Roadshow Pictures,  Warner Bros.,  Plan B Entertainment,  The Zanuck Company"
Charlie's Angels,16,Columbia Pictures
Charlie's Angels: Full Throttle,31," Flower Films (II), Columbia Pictures Corporation,  Tall Trees Productions,  Wonderland Sound and Vision"
Cheaper by the Dozen,20," Robert Simonds Productions, Twentieth Century Fox Film Corporation"
Cheaper by the Dozen 2,22,Twentieth Century Fox Film Corporation
Chef,4," Fetisov Teterin Films,  Aldamisa Entertainment,  Kilburn Media, Open Road Films"
Chicago,7," Producers Circle,  Storyline Entertainment, Miramax Films"
Chicken Little,14,"Walt Disney Pictures,  Walt Disney Feature Animation"
Chicken Run,11," Pathé, DreamWorks SKG,  DreamWorks Animation,  Aardman Animations"
Child 44,8,"Summit Entertainment,  Scott Free Productions,  Worldview Entertainment"
Children of Men,15," Strike Entertainment,  Hit & Run Productions, Universal Pictures"
Chloe,5," Outpost Studios,  Montecito Picture Company,  The, StudioCanal"
Chocolat,8," Fat Free,  David Brown Productions, Miramax Films"
Chronicle,9," Davis Entertainment, Twentieth Century Fox Film Corporation,  Adam Schroeder Productions,  Dune Entertainment"
Cinderella,10,"Walt Disney Pictures,  Beagle Pug Films,  Allison Shearmur Productions,  Genre Films"
Cinderella Man,14,"Miramax Films,  Universal Pictures,  Imagine Entertainment,  Touchstone Pictures,  Parkway Pictures (I)"
Cirque du Freak: The Vampire's Assistant,40,Universal Pictures
City By The Sea,15," Franchise Pictures,  Brad Grey Pictures,  Sea Breeze Productions Inc., Warner Bros. Pictures,  Epsilon Motion Pictures"
City of Ember,13," Walden Media, Playtone"
Clash of the Titans,19," Legendary Pictures, The Zanuck Company,  Thunder Road Pictures,  Warner Bros.,  Moving Picture Company (MPC)"
Clerks II,9," View Askew Productions, The Weinstein Company"
