original_title,title_length,production_companies
Secret Window,13," Grand Slam Productions,  Pariah Entertainment Group, Columbia Pictures Corporation,  Mel's Cite du Cinema"
Secret in Their Eyes,20," IM Global, Ingenious Media,  Route One Films,  Gran Via Productions"
Secretariat,11,"Walt Disney Pictures,  Mayhem Pictures,  Fast Track Productions"
Seed of Chucky,14,Rogue Pictures
Seeking Justice,15," Maguire Entertainment,  Aura Film Partnership,  Fierce Entertainment,  Ram Bergman Productions, Endgame Entertainment"
Self/less,9,"Endgame Entertainment,  Ram Bergman Productions"
Selma,5," Harpo Films,  Celador Films,  Pathé,  Cloud Eight Films, Plan B Entertainment"
Serendipity,11," Simon Fields Productions, Miramax Films,  Tapestry Films"
Serving Sara,12,Paramount Pictures
Seven Pounds,12,"Columbia Pictures,  Relativity Media,  Overbrook Entertainment,  Escape Artists"
Seven Psychopaths,17," British Film Institute (BFI),  CBS Films, Blueprint Pictures,  Film4"
Seventh Son,11," Thunder Road Pictures,  Moving Picture Company (MPC), Legendary Pictures,  Pendle Mountain Productions,  Outlaw Sinema"
Sex Tape,8," Sony Pictures Entertainment (SPE),  Media Rights Capital, Escape Artists,  LStar Capital"
Sex and the City,16," Darren Star Productions,  Home Box Office (HBO), New Line Cinema"
Sex and the City 2,18,"New Line Cinema,  HBO Films,  Village Roadshow Pictures,  Home Box Office (HBO)"
Shaft,5," Scott Rudin Productions, Paramount Pictures"
Shall We Dance?,15,Miramax Films
Shallow Hal,11,Twentieth Century Fox Film Corporation
Shanghai Knights,16," Jackie Chan Films Limited,  Touchstone Pictures,  Birnbaum / Barber Productions, Spyglass Entertainment,  All Knight Productions"
Shark Night,11,Incentive Filmed Entertainment
Shark Tale,10," Pacific Data Images (PDI),  DreamWorks Animation, DreamWorks SKG"
She's Out of My League,22," Mosaic, DreamWorks SKG"
She's the Man,13,"DreamWorks SKG,  Lakeshore Entertainment"
Sherlock Holmes,15," Silver Pictures,  Wigram Productions,  Warner Bros.,  Internationale Filmproduktion Blackbird Dritte, Village Roadshow Pictures"
Sherlock Holmes: A Game of Shadows,34," Warner Bros., Village Roadshow Pictures,  Lin Pictures,  Wigram Productions,  Silver Pictures"
Shoot 'Em Up,12," Angry Films, New Line Cinema"
Shooter,7," Di Bonaventura Pictures, Paramount Pictures,  Grosvenor Park Impact Productions"
Shorts,6,Warner Bros. Pictures
Showtime,8," Tribeca Productions, Village Roadshow Pictures,  Warner Bros.,  Overbrook Entertainment,  NPV Entertainment"
Shrek,5," DreamWorks Animation,  Pacific Data Images (PDI), DreamWorks SKG"
Shrek 2,7," Pacific Data Images (PDI),  DreamWorks Animation, DreamWorks SKG"
Shrek Forever After,19,DreamWorks Animation
Shrek the Third,15,DreamWorks Animation
Shutter Island,14," Phoenix Pictures,  Sikelia Productions,  Appian Way, Paramount Pictures"
Sicario,7,"Lionsgate,  Thunder Road Pictures,  Black Label Media"
Sicko,5,The Weinstein Company
Side Effects,12," Open Road Films,  Universal,  Endgame Entertainment, Di Bonaventura Pictures"
Sideways,8," Sideways Productions Inc., Fox Searchlight Pictures,  Michael London Productions"
Signs,5," Touchstone Pictures, Kennedy/Marshall Company,  Blinding Edge Pictures,  The"
Silent Hill,11," Davis-Films,  Konami, Silent Hill DCP Inc."
Silent Hill: Revelation 3D,26," Konami Corporation Ltd., Davis-Films"
Silver Linings Playbook,23,The Weinstein Company
Sin City,8,"Dimension Films,  Troublemaker Studios,  Miramax"
Sin City: A Dame to Kill For,28," Aldamisa Entertainment,  Demarest Films,  AR Films, Miramax Films,  Troublemaker Studios"
Sinister 2,10," Entertainment One,  IM Global,  Blumhouse Productions, Alliance Films,  Automatik Entertainment"
Sisters,7,Little Stranger
Sky Captain and the World of Tomorrow,37," Natural Nylon Entertainment, Paramount Pictures,  Riff Raff Film Productions,  Blue Flower Productions,  Filmauro"
Sky High,8," Gunn Films, Walt Disney Pictures,  Max Stronghold Productions Inc."
Skyfall,7,Columbia Pictures
Skyline,7," Relativity Media, Rogue Pictures,  Transmission Pictures,  Rat Entertainment,  Hydraulx"
Slackers,8,"Sony Pictures,  Screen Gems"
Slumdog Millionaire,19,"Celador Films,  Film4,  Warner Bros."
Smart People,12," Groundswell Productions,  Sherazade Film Development,  Corduroy Films,  QED International, Miramax Films"
Smokin' Aces,12,"Universal Pictures,  StudioCanal,  Working Title Films,  Scion Films,  Relativity Media"
Snakes on a Plane,17,New Line Cinema
Snatch,6,"Columbia Pictures Corporation,  SKA Films"
Snitch,6,"Front Street Productions,  Exclusive Media Group,  Spitfire Pictures,  Participant Media,  Imagenation Abu Dhabi FZ"
Snow White and the Huntsman,27," Roth Films, Universal Pictures"
Solaris,7,"Twentieth Century Fox Film Corporation,  Lightstorm Entertainment"
Solitary Man,12,"Smartest Man Productions,  Paul Schiff Productions,  Millennium Films"
Solomon Kane,12,"Davis-Films,  Czech Anglo Productions,  Wandering Star Pictures"
Something Borrowed,18," Wild Ocean Films, Alcon Entertainment,  2S Films"
Something's Gotta Give,22," Warner Bros., Columbia Pictures Corporation,  Waverly Films"
Son of God,10,"Hearst Entertainment Productions,  LightWorkers Media"
Sorority Row,12," Karz Entertainment, Summit Entertainment"
Soul Surfer,11," TriStar Pictures,  Brookwell-McNamara Entertainment,  Affirm Films,  FilmDistrict, Mandalay Pictures"
Source Code,11,"The Mark Gordon Company,  Vendome Pictures"
Southpaw,8," Riche-Ludwig Productions, Escape Artists"
Space Chimps,12," Starz Animation,  Vanguard Animation, Starz Media,  Studiopolis,  Odyssey Entertainment"
Space Cowboys,13," Clipsal Films,  Malpaso Productions,  Mad Chance,  Warner Bros., Village Roadshow Pictures"
Spanglish,9," Columbia Pictures Corporation, Gracie Films"
Sparkle,7,"TriStar Pictures,  Phoenix Pictures,  Akil Production Company,  Stage 6 Films"
Spartan,7," Art Linson Productions,  Franchise Pictures,  Signature Pictures, Epsilon Motion Pictures,  Linson Entertainment"
Spectre,7,"Columbia Pictures,  B24,  Danjaq"
Speed Racer,11," Anarchos Productions,  Warner Bros., Village Roadshow Pictures,  Silver Pictures,  Studio Babelsberg"
Spider-Man,10," Marvel Enterprises, Columbia Pictures"
Spider-Man 2,12," Columbia Pictures Corporation,  Marvel Enterprises, Laura Ziskin Productions"
Spider-Man 3,12," Laura Ziskin Productions,  Marvel Enterprises, Columbia Pictures"
Spirit: Stallion of the Cimarron,32,DreamWorks Animation
Spotlight,9," Rocklin / Faust,  Open Road Films,  Entertainment One Features,  Anonymous Content, Participant Media"
Spring Breakers,15," Muse Productions, RabbitBandini Productions,  Radar Pictures,  Division Films,  Pop Films"
Spy,3," Chernin Entertainment,  Feigco Entertainment, Twentieth Century Fox Film Corporation"
Spy Game,8," Red Wagon Productions,  Toho-Towa,  Beacon Communications,  Metropolitan Filmexport, Universal Pictures"
Spy Kids,8,"Dimension Films,  Troublemaker Studios,  Miramax"
Spy Kids 2: Island of Lost Dreams,33,Dimension Films
Spy Kids 3-D: Game Over,23,Dimension Films
St. Vincent,11,"The Weinstein Company,  Crescendo Productions,  Chernin Entertainment,  Goldenlight Films"
Star Trek,9," Spyglass Entertainment, Paramount Pictures,  Bad Robot,  MavroCine Pictures GmbH & Co. KG"
Star Trek Into Darkness,23," Skydance Productions,  Bad Robot,  Kurtzman/Orci, Paramount Pictures"
Star Trek: Nemesis,18,Paramount Pictures
Star Wars: Episode II - Attack of the Clones,44,Lucasfilm
Star Wars: Episode III - Revenge of the Sith,44,Lucasfilm
Star Wars: The Force Awakens,28," Bad Robot,  Truenorth Productions, Lucasfilm"
Stardust,8," Vaughn Productions, Paramount Pictures,  Marv Films,  Ingenious Film Partners,  Di Bonaventura Pictures"
Starsky & Hutch,15," Warner Bros.,  AR-TL,  Dimension Films,  Red Hour Films, Weed Road Pictures"
State of Play,13," StudioCanal,  Relativity Media, Universal Pictures,  Andell Entertainment,  Working Title Films"
Stay,4," Regency Enterprises, 20th Century Fox"
Stay Alive,10," Hollywood Pictures,  Wonderland Sound and Vision, Spyglass Entertainment,  Endgame Entertainment"
Stealth,7," Phoenix Pictures, Laura Ziskin Productions,  AFG Talons Productions,  Original Film,  Columbia Pictures Corporation"
Step Brothers,13," Gary Sanchez Productions, Columbia Pictures,  Mosaic Media Group,  Relativity Media,  Apatow Productions"
Step Up,7," Touchstone Pictures,  Offspring Entertainment, Summit Entertainment,  Eketahuna LLC"
Step Up 2: The Streets,22," Touchstone Pictures, Summit Entertainment,  Offspring Entertainment"
Step Up 3D,10," Touchstone Pictures, Summit Entertainment"
Step Up All In,14," Offspring Entertainment, Summit Entertainment"
Step Up Revolution,18,Summit Entertainment
Stolen,6," Nu Image Films, Saturn Films,  Millennium Films"
Stomp the Yard,14,Rainforest Films
Stone,5,"Stone Productions,  Mimran Schur Pictures"
Stormbreaker,12," Weinstein Company,  Samuelson Productions,  The, Isle of Man Film"
Straight Outta Compton,22," Cube Vision,  Broken Chair Flickz,  Legendary Pictures, New Line Cinema,  Universal Pictures"
Stranger Than Fiction,21," Three Strange Angels, Mandate Pictures"
Straw Dogs,10,Battleplan Productions
Street Fighter: The Legend of Chun-Li,37," Hyde Park Films, Twentieth Century Fox Film Corporation"
Street Kings,12,"Fox Searchlight Pictures,  Dune Entertainment III,  Regency Enterprises,  Emmett/Furla Films"
Stuart Little 2,15,"Columbia Pictures,  Sony Pictures Entertainment"
Stuck on You,12," Conundrum Entertainment, Twentieth Century Fox Film Corporation"
Sucker Punch,12," Cruel and Unusual Films,  Warner Bros.,  Lennox House Films, Legendary Pictures"
Suffragette,11," Pathé,  Film4, Ruby Films"
Sugar & Spice,13,New Line Cinema
Suite Française,16,"Qwerty Films,  TF1 Droits Audiovisuels,  Alliance Films,  Canal+,  Scope Pictures"
Summer Catch,12,"Tollin/Robbins Productions,  Warner Bros."
Sunshine,8," Ingenious Film Partners,  Moving Picture Company (MPC),  UK Film Council, DNA Films"
Super 8,7,"Paramount Pictures,  Bad Robot,  Amblin Entertainment,  K/O Camera Toys"
Superbad,8,"Columbia Pictures,  Apatow Productions"
Superhero Movie,15,Dimension Films
Supernova,9," Screenland Pictures,  Hammerhead Productions, United Artists,  Metro-Goldwyn-Mayer (MGM)"
Surf's Up,9,Sony Pictures Animation
Surrogates,10,"Touchstone Pictures,  Wintergreen Productions,  Mandeville Films,  Top Shelf Productions"
Suspect Zero,12,"Paramount Pictures,  Cruise/Wagner Productions,  Intermedia Films,  Lakeshore Entertainment"
Sweeney Todd: The Demon Barber of Fleet Street,46," Zanuck Company,  Parkes+MacDonald Image Nation,  The,  Tim Burton Productions,  DreamWorks Pictures, Warner Bros."
Sweet Home Alabama,18,Touchstone Pictures
Sweet November,14,"Bel Air Entertainment,  Warner Bros."
Swimming Pool,13," Canal Plus,  Fidélité Productions,  Gimages, France 2 Cinéma,  FOZ"
Swing Vote,10,Touchstone Pictures
Swordfish,9," Silver Pictures,  Jonathan Krane Group,  Warner Bros.,  NPV Entertainment, Village Roadshow Pictures"
Sydney White,12,"Morgan Creek Productions,  Clifford Werber Productions,  SW7D Productions"
Sylvia,6,Focus Films
Syriana,7," FilmWorks,  Participant Media, Section Eight,  Warner Bros.,  4M"
TMNT,4," Imagi Animation Studios,  Mirage Studios, The Weinstein Company,  Imagi Production,  Warner Bros."
TRON: Legacy,12," Prana Studios, Walt Disney Pictures,  Revolution Sun Studios,  LivePlanet,  Sean Bailey Productions"
Take Me Home Tonight,20," Rogue Pictures, Imagine Entertainment,  Relativity Media,  Internationale Filmproduktion Blackbird Dritte"
Take the Lead,13,"New Line Cinema,  Tiara Blu Films"
Taken,5," M6 Films, Twentieth Century Fox Film Corporation,  Canal+,  TPS Star,  Grive Productions"
Taken 2,7," Canal+, Twentieth Century Fox Film Corporation,  Grive Productions,  EuropaCorp,  M6 Films"
Taken 3,7," M6 Films,  Canal+,  EuropaCorp,  Ciné+, Twentieth Century Fox Film Corporation"
Takers,6,Rainforest Films
Taking Lives,12," Atmosphere Entertainment MM,  Warner Bros., Village Roadshow Pictures"
Talladega Nights: The Ballad of Ricky Bobby,43," Apatow Productions, Columbia Pictures"
Tammy,5," Gary Sanchez Productions, New Line Cinema"
Tangled,7," Walt Disney Animation Studios, Walt Disney Pictures"
Taxi,4,"Twentieth Century Fox Film Corporation,  EuropaCorp,  Robert Simonds Productions"
Team America: World Police,26,"Paramount Pictures,  Scott Rudin Productions"
Tears of the Sun,16,"Columbia Pictures,  Revolution Studios,  Cheyenne Enterprises,  Michael Lobell Productions"
Ted,3," Fuzzy Door Productions, Universal Pictures,  Media Rights Capital"
Ted 2,5," Media Rights Capital,  Fuzzy Door Productions, Universal Pictures"
Teenage Mutant Ninja Turtles,28," Platinum Dunes, Paramount Pictures,  Nickelodeon Movies"
Tenacious D in The Pick of Destiny,34,Red Hour Films
Terminator 3: Rise of the Machines,34," Warner Bros.,  C-2 Pictures, Columbia Pictures,  Intermedia Films,  IMF Internationale Medien und Film GmbH & Co. 3. Produktions KG"
Terminator Genisys,18,"Paramount Pictures,  Skydance Productions"
Terminator Salvation,20," Wonderland Sound and Vision,  The Halcyon Company, Columbia Pictures,  Warner Bros."
Texas Chainsaw 3D,17," Lions Gate, Nu Image Films"
Thank You for Smoking,21," Room 9 Entertainment, Fox Searchlight Pictures"
That Awkward Moment,19,Treehouse Pictures
That's My Boy,13,"Columbia Pictures,  Happy Madison Productions,  Relativity Media"
The 40 Year Old Virgin,22," Apatow Productions, Universal Pictures"
The 6th Day,11,"Columbia Pictures,  Phoenix Pictures"
The A-Team,10,20th Century Fox
The Adjustment Bureau,21," Media Rights Capital,  Gambit Pictures, Universal Pictures,  Electric Shepherd Productions"
The Adventures of Pluto Nash,28," Mel's Cite du Cinema,  Castle Rock Entertainment, Village Roadshow Pictures,  NPV Entertainment"
The Adventures of Rocky & Bullwinkle,36,"Universal Pictures,  Capella International,  KC Medien AG,  Tribeca Productions"
The Adventures of Sharkboy and Lavagirl,39,"Columbia Pictures Corporation,  Dimension Films"
The Adventures of Tintin,24," Nickelodeon Movies,  Columbia Pictures, Paramount Pictures,  WingNut Films,  Amblin Entertainment"
The Age of Adaline,18," Sidney Kimmel Entertainment, Lakeshore Entertainment,  Sierra/Affinity"
The Alamo,9," Touchstone Pictures, Imagine Entertainment"
The Amazing Spider-Man,22," Marvel Entertainment, Columbia Pictures,  Laura Ziskin Productions"
The Amazing Spider-Man 2,24," Marvel Enterprises, Columbia Pictures,  Matt Tolmach Productions,  Avi Arad Productions"
The Amityville Horror,21," Radar Pictures, Platinum Dunes,  Dimension Films,  Metro-Goldwyn-Mayer (MGM)"
The Animal,10,"Revolution Studios,  Happy Madison Productions"
The Ant Bully,13," Legendary Pictures,  Playtone Production,  Warner Bros. Animation,  DNA Films, Warner Bros. Pictures"
The Apparition,14,"StudioCanal,  Warner Bros.,  Dark Castle Entertainment,  Studio Babelsberg Motion Pictures"
The Art of War,14," Warner Bros.,  Morgan Creek Productions,  Franchise Pictures, Amen Ra Films"
The Artist,10," La Petite Reine, France 3 Cinéma,  uFilm,  Jouror Productions,  Studio 37"
The Assassination of Jesse James by the Coward Robert Ford,58," Scott Free Productions,  Alberta Film Entertainment,  Warner Bros.,  Virtual Studios, Plan B Entertainment"
The Avengers,12,Marvel Studios
The Aviator,11," Forward Pass,  Cappa Productions, Appian Way,  Warner Bros.,  Initial Entertainment Group (IEG)"
The Back-Up Plan,16," CBS Films, Escape Artists"
The Bad Lieutenant: Port of Call - New Orleans,46," Polsky Films,  Nu Image Films, Saturn Films,  Millennium Films,  Edward R. Pressman Film"
The Beach,9," Figment Films, 20th Century Fox"
The Best Exotic Marigold Hotel,30," Imagenation Abu Dhabi FZ, Participant Media"
The Best Man Holiday,20,Universal
The Best of Me,14,Relativity Media
The Big Bounce,14,"Warner Bros. Pictures,  Taormina Productions,  Material,  Shangri-La Entertainment"
The Big Short,13,"Paramount Pictures,  Plan B Entertainment,  Regency Enterprises"
The Big Wedding,15,"Millenium Films,  Two Ton Films"
The Big Year,12,"Ingenious Media,  Fox 2000 Pictures,  Dune Entertainment,  Deuce Three Productions,  Sunswept Entertainment"
The Blind Side,14," Zucker/Netter Productions,  Left Tackle Pictures, Alcon Entertainment"
The Bling Ring,14,"Pathé Distribution,  A24"
The Boat That Rocked,20," Studio Canal,  Medienproduktion Prometheus Filmgesellschaft,  Portobello Studios,  Working Title Films, Universal Pictures"
The Book of Eli,15," Silver Pictures, Alcon Entertainment"
The Boondock Saints II: All Saints Day,38," Stage 6 Films, Chris Brinker Productions"
The Bounty Hunter,17," Original Film, Columbia Pictures,  Relativity Media,  Madhouse Entertainment"
The Bourne Identity,19," Kalima Productions GmbH & Co. KG, Universal Pictures,  Kennedy/Marshall Company,  Stillking Films,  Hypnotic,  The"
The Bourne Legacy,17," Relativity Media,  The,  Kennedy/Marshall Company,  Captivate Entertainment, Universal Pictures,  Dentsu"
The Bourne Supremacy,20," The Kennedy/Marshall Company, Universal Pictures,  Hypnotic,  Motion Picture THETA Produktionsgesellschaft,  Ludlum Entertainment"
The Bourne Ultimatum,20," Motion Picture BETA Produktionsgesellschaft, Universal Pictures,  The Kennedy/Marshall Company,  Bourne Again,  Ludlum Entertainment"
The Box,7," Darko Entertainment,  Warner Bros., Media Rights Capital,  Lin Pictures,  Radar Pictures"
The Boxtrolls,13,Laika Entertainment
The Boy in the Striped Pyjamas,30," Heyday Films,  BBC Films, Miramax Films"
The Break-Up,12," Mosaic Media Group,  Wild West Picture Show Productions, Universal Pictures"
The Brothers Bloom,18," Endgame Entertainment,  Summit Entertainment, The Weinstein Company"
The Brothers Grimm,18," Reforma Films,  Atlas Entertainment, The Weinstein Company,  Summit Entertainment,  Mosaic Media Group"
The Bucket List,15," Storyline Entertainment,  Two Ton Films,  Zadan / Meron Productions, Warner Bros."
The Butler,10,"Laura Ziskin Productions,  Lee Daniels Entertainment,  Salamander Pictures,  Pam Williams Productions,  Follow Through Productions"
The Butterfly Effect,20," FilmEngine,  BenderSpink, New Line Cinema,  Katalyst Films,  Province of British Columbia Production Services Tax Credit"
The Cabin in the Woods,22," Mutant Enemy Productions, Lionsgate"
The Call,8," Emergency Films, TriStar Pictures,  WWE Studios,  Troika Pictures,  Apotheosis Media Group"
The Cat's Meow,14," Dan Films, Lions Gate Films,  CP Medien AG"
The Cave,8," City Productions,  Cineblue Internationale Filmproduktionsgesellschaft,  Screen Gems, Lakeshore Entertainment,  Cinerenta Medienbeteiligungs KG"
The Cell,8," Katira Productions GmbH & Co. KG,  Avery Pix,  Radical Media,  Caro-McLeod, New Line Cinema"
The Change-Up,13," Original Film, Universal Pictures,  Big Kid Pictures,  Relativity Media"
The Chronicles of Narnia: Prince Caspian,40," Propeler,  Walden Media,  Stillking Films, Walt Disney,  Ozumi Films"
"The Chronicles of Narnia: The Lion, the Witch and the Wardrobe",62," Walden Media, Walt Disney"
The Chronicles of Narnia: The Voyage of the Dawn Treader,56," Fox 2000 Pictures,  Walden Media, Dune Entertainment"
The Chronicles of Riddick,25,"Universal Pictures,  Radar Pictures,  One Race Productions,  Primal Foe Productions"
The Cold Light of Day,21," Film Rites,  Picture Machine,  Galavis Film, Summit Entertainment,  Intrepid Pictures"
The Company Men,15,"Spring Creek Productions,  Battle Mountain Films"
The Conjuring,13," The Safran Company, New Line Cinema,  Evergreen Media Group"
The Conspirator,15,"Wildwood Enterprises,  American Film Company"
The Constant Gardener,21," Focus Features,  Epsilon Motion Pictures,  UK Film Council,  Scion Films, Studio Babelsberg"
The Contract,12,"Nu Image Entertainment,  3L Filmverleih"
The Core,8,"Paramount Pictures,  Core Productions,  Horsepower Films,  LivePlanet,  David Foster Productions"
The Counselor,13," Scott Free Productions, Ingenious Media,  Fox 2000 Pictures,  Kanzaman,  Nick Wechsler Productions"
The Covenant,12," Inc., Screen Gems"
The Crazies,11,"Penn Station Entertainment,  Participant Media,  Overture Films,  Imagenation Abu Dhabi FZ"
The Croods,10,DreamWorks Animation
The Curious Case of Benjamin Button,35,"Paramount Pictures,  Kennedy/Marshall Company,  Warner Bros.,  The"
The Curse of the Were-Rabbit,28,"Aardman Animations,  DreamWorks Animation"
The DUFF,8,"Wonderland Sound and Vision,  Vast Entertainment,  CBS Films"
The Da Vinci Code,17," Imagine Entertainment,  Government of Malta, Columbia Pictures,  Skylark Productions"
The Danish Girl,15," Artémis Productions, Pretty Pictures,  Working Title Films,  Taxshelter. be,  Le Tax Shelter du Gouvernement Fédéral de Belgique"
The Dark Knight,15," Legendary Pictures,  Syncopy, DC Comics,  Warner Bros."
The Dark Knight Rises,21," DC Entertainment, Legendary Pictures,  Warner Bros.,  Syncopy"
The Darkest Hour,16," New Regency Pictures,  Regency Enterprises,  Bazelevs Production, Summit Entertainment,  The Jacobson Company"
The Day After Tomorrow,22,"Lions Gate Films,  Mel's Cite du Cinema,  Twentieth Century Fox Film Corporation,  Mark Gordon Productions,  Centropolis Entertainment"
The Day the Earth Stood Still,29," 3 Arts Entertainment,  Earth Canada Productions,  Dune Entertainment III, Twentieth Century Fox Film Corporation,  Hammerhead Productions"
The Debt,8," Marv Films,  Pioneer Pictures, Miramax Films"
The Departed,12," Media Asia Films,  Initial Entertainment Group (IEG),  Warner Bros., Vertigo Entertainment,  Plan B Entertainment"
The Descendants,15,"Fox Searchlight Pictures,  Dune Entertainment,  Ad Hominem Enterprises"
The Devil Wears Prada,21," Major Studio Partners, Twentieth Century Fox Film Corporation,  Peninsula Films,  Dune Entertainment,  Fox 2000 Pictures"
The Devil's Double,18," Corsan, Corrino Media Corporation,  Staccato Films"
The Dictator,12,Paramount Pictures
The Dilemma,11," Spyglass Entertainment, Imagine Entertainment,  Universal Pictures,  Wild West Picture Show Productions"
The Dressmaker,14,"Amazon Studios,  Apollo Media,  Film Art Media"
The Dukes of Hazzard,20,"Village Roadshow Pictures,  WV Films III,  Gerber Pictures,  Warner Bros."
The Eagle,9," Film4,  Prime Focus, Toledo Productions,  Focus Features,  Twins Financing"
The East,8,Scott Free Productions
The Emperor's New Groove,24,"Walt Disney Pictures,  Walt Disney Feature Animation"
The Equalizer,13," LStar Capital,  Mace Neufeld Productions,  Village Roadshow Pictures,  Escape Artists, Columbia Pictures"
The Exorcism of Emily Rose,26," Screen Gems, Lakeshore Entertainment,  Firm Films"
The Expendables,15,Millennium Films
The Expendables 2,17," Millennium Films, Nu Image Films"
The Expendables 3,17," LionsGate, Davis-Films,  Nu Image Films,  Ex3 Productions,  Millennium Films"
The Express,11," IDEA Filmproduktions, Davis Entertainment,  Relativity Media"
The Eye,7," VN Productions, Paramount Vantage"
The Family,10," TF1 Films Production,  Relativity Media, Canal Plus,  Grive Productions,  EuropaCorp"
The Family Man,14,Universal Pictures
The Fast and the Furious,24," Ardustry Entertainment,  Mediastream Film GmbH & Co. Productions KG, Universal Pictures,  Original Film"
The Fast and the Furious: Tokyo Drift,37,Universal Pictures
The Fault in Our Stars,22," TSG Entertainment, Fox 2000 Pictures,  Temple Hill Entertainment"
The Fifth Estate,16," Reliance Entertainment,  Participant Media, DreamWorks SKG,  Touchstone Pictures,  Anonymous Content"
The Fighter,11,Paramount Pictures
The Final Destination,21,"New Line Cinema,  Practical Pictures,  Parallel Zide"
The Five-Year Engagement,24," Dentsu,  Relativity Media,  Stoller Global Solutions,  Apatow Productions, Universal Pictures"
The Flintstones in Viva Rock Vegas,34,"Universal Pictures,  Amblin Entertainment"
The Fog,7," Debra Hill Productions, Revolution Studios"
The Forbidden Kingdom,21,"Casey Silver Productions,  China Film Co-Production Corporation,  Huayi Brothers,  Relativity Media"
The Forgotten,13," Visual Arts Entertainment, Revolution Studios,  Jinks/Cohen Company"
The Fountain,12," New Regency Pictures, Regency Enterprises,  Warner Bros.,  Protozoa Pictures,  Muse Entertainment Enterprises"
The Four Feathers,17," Dune Films,  Jaffilms Inc., Paramount Pictures,  Marty Katz Productions,  Miramax Films"
The Fourth Kind,15," Focus Films,  Gold Circle Films,  Saga Film,  Chambara Pictures, Universal Pictures"
The Frozen Ground,17,"Grindstone Entertainment Group,  Cheetah Vision,  Emmett/Furla Films,  Paradox Entertainment,  K5 International"
The Gambler,11,"Paramount Pictures,  Winkler Films"
The Game Plan,13," Monkey Dance Productions, Walt Disney Pictures,  Mayhem Pictures"
The Ghost Writer,16," France 2 Cinéma, Studio Babelsberg,  Runteam Ltd.,  R.P. Productions"
The Gift,8," Blue-Tongue Films, Lakeshore Entertainment,  STX Entertainment,  Ahimsa Films,  Alphaville Films, Blumhouse Productions"
The Girl Next Door,18," New Regency Pictures, Regency Enterprises,  Daybreak,  Epsilon Motion Pictures"
The Girl with the Dragon Tattoo,31," Film Rites, Columbia Pictures,  Yellow Bird,  Metro-Goldwyn-Mayer (MGM),  Scott Rudin Productions"
The Giver,9,"The Weinstein Company,  Tonik Productions,  Walden Media,  Asis Productions"
The Glass House,15,Original Film
The Golden Compass,18,"New Line Cinema,  Scholastic Productions,  Ingenious Film Partners,  Depth of Field"
The Good Dinosaur,17," Pixar Animation Studios,  Buena Vista, Walt Disney Pictures"
The Good German,15," Sunset Gower Studios, Warner Bros.,  Section Eight Productions"
The Good Girl,13,"Fox Searchlight Pictures,  Hungry Eye Lowland Pictures B.V.,  Flan de Coco Films"
The Good Shepherd,17," Morgan Creek Productions,  American Zoetrope, Universal Pictures"
The Grand Budapest Hotel,24," Indian Paintbrush,  Scott Rudin Productions,  Studio Babelsberg, Fox Searchlight Pictures,  TSG Entertainment"
The Grand Seduction,19,"Max Films Productions,  Morag Loves Company"
