original_title,title_length,production_companies
Hannah Montana: The Movie,25," Millar Gough Ink, Walt Disney Pictures,  It's a Laugh Productions"
Hannibal,8,"Universal Pictures,  Dino De Laurentiis Company,  Metro-Goldwyn-Mayer (MGM),  Scott Free Productions"
Hannibal Rising,15," Dino De Laurentiis Company,  Quinta Communications, Ingenious Film Partners,  ETIC Films,  Zephyr Films"
Hansel & Gretel: Witch Hunters,30,"Paramount Pictures,  Studio Babelsberg,  Metro-Goldwyn-Mayer (MGM),  Gary Sanchez Productions,  MTV Films"
Happy Feet,10," Kennedy Miller Productions,  Animal Logic,  Kingdom Feature Productions,  Warner Bros., Village Roadshow Pictures"
Happy Feet Two,14," Kennedy Miller Mitchell,  Warner Bros.,  Dr D Studios, Village Roadshow Pictures"
Hardball,8," Nides/McCormick Productions,  Munich Film Partners & Company (MFP) GHS Productions,  GHS Productions KG, Paramount Pictures"
Hardcore Henry,14," Versus Pictures, Bazelevs Production"
Harold & Kumar Escape from Guantanamo Bay,41,New Line Cinema
Harold & Kumar Go to White Castle,33,New Line Cinema
Harry Brown,11," Marv Films, HanWay Films,  UK Film Council"
Harry Potter and the Chamber of Secrets,39,"1492 Pictures,  MIRACLE Productions GmbH & Co. KG,  Heyday Films,  Warner Bros."
Harry Potter and the Deathly Hallows: Part 1,44,"Warner Bros.,  Heyday Films"
Harry Potter and the Deathly Hallows: Part 2,44," Heyday Films, Warner Bros.,  Moving Picture Company (MPC)"
Harry Potter and the Goblet of Fire,35,"Patalex IV Productions Limited,  Heyday Films,  Warner Bros."
Harry Potter and the Half-Blood Prince,38," Heyday Films, Warner Bros."
Harry Potter and the Order of the Phoenix,41," Heyday Films,  Warner Bros., Cool Music,  Harry Potter Publishing Rights"
Harry Potter and the Philosopher's Stone,40," Warner Bros., 1492 Pictures,  Heyday Films"
Harry Potter and the Prisoner of Azkaban,40," Warner Bros.,  Heyday Films,  P of A Productions Limited, 1492 Pictures"
Hart's War,10," Cheyenne Enterprises,  David Ladd Films, David Foster Productions,  Metro-Goldwyn-Mayer (MGM)"
Haywire,7,"Irish Film Board,  Relativity Media"
He's Just Not That Into You,27," Flower Films (II),  Internationale Filmproduktion Blackswan, New Line Cinema"
Head Over Heels,15,Universal Studios
Hearts in Atlantis,18,Castle Rock Entertainment
Heaven is for Real,18,"TriStar Pictures,  Roth Films,  Screen Gems"
Hellboy,7,"Revolution Studios,  Dark Horse Entertainment,  Starlite Films,  Lawrence Gordon Productions"
Hellboy II: The Golden Army,27," Relativity Media,  Dark Horse Entertainment, Universal Pictures,  Mid Atlantic Films,  Lawrence Gordon Productions"
Her,3,Annapurna Pictures
Herbie Fully Loaded,19," Robert Simonds Productions, Walt Disney Pictures"
Hercules,8," Metro-Goldwyn-Mayer (MGM), Paramount Pictures,  Flynn Picture Company,  Radical Studios"
Hereafter,9," Malpaso Productions, Amblin Entertainment,  Warner Bros.,  The,  Kennedy/Marshall Company"
Hidalgo,7,"Casey Silver Productions,  Touchstone Pictures,  Dune Films"
Hide and Seek,13," MBC Beteiligungs Filmproduktion, Twentieth Century Fox Film Corporation,  Fox 2000 Pictures,  Josephson Entertainment"
High Crimes,11," New Regency Pictures,  Monarch Pictures,  Regency Enterprises,  Epsilon Motion Pictures, Twentieth Century Fox Film Corporation"
High Fidelity,13," Touchstone Pictures, Buena Vista"
Highlander: Endgame,19," Dimension Films, Davis-Panzer Productions"
Hitch,5," Overbrook Entertainment, Columbia Pictures Corporation"
Hitman,6," Anka Film,  EuropaCorp, Twentieth Century Fox Film Corporation,  Dune Entertainment,  Daybreak Productions"
Hitman: Agent 47,16," TSG Entertainment, Twentieth Century Fox Film Corporation,  Fox International Productions,  Infinite Frameworks Studios"
Hollow Man,10," Global Entertainment Productions GmbH & Company Medien KG, Columbia Pictures Corporation"
Home,4," DreamWorks Animation, Twentieth Century Fox Film Corporation"
Home on the Range,17," Walt Disney Feature Animation, Walt Disney Pictures"
Homefront,9,"Millennium Films,  Open Road Films"
Honey,5," NuAmerica Entertainment, Universal Pictures,  Marc Platt Productions"
Hoodwinked Too! Hood VS. Evil,29,HW Two
Hoodwinked!,11," Blue Yonder Films,  Kanbar Entertainment, The Weinstein Company"
Hop,3,"Universal Pictures,  Illumination Entertainment"
Hope Springs,12," Metro-Goldwyn-Mayer (MGM),  Management 360, Columbia Pictures,  Escape Artists,  Mandate Pictures"
Horrible Bosses,15," Rat Entertainment, New Line Cinema"
Horrible Bosses 2,17," RatPac Entertainment, New Line Cinema,  BenderSpink"
Horton Hears a Who!,19," Twentieth Century Fox Animation,  Blue Sky Studios, Twentieth Century Fox Film Corporation"
Hostage,7," Yari Film Group,  Stratus Film Co.,  Syndicate Films International,  Cheyenne Enterprises, Miramax Films"
Hostel: Part II,15," Screen Gems,  Next Entertainment, Lions Gate Films"
Hot Pursuit,11,"New Line Cinema,  Warner Bros.,  Metro-Goldwyn-Mayer (MGM),  Pacific Standard"
Hot Tub Time Machine,20,"United Artists,  Metro-Goldwyn-Mayer (MGM),  New Crime Productions"
Hotel Rwanda,12," Industrial Development Corporation of South Africa,  United Artists,  Miracle Pictures,  Endgame Entertainment, Lions Gate Films"
Hotel Transylvania,18," Sony Pictures Animation, Columbia Pictures"
Hotel Transylvania 2,20,"Columbia Pictures,  Sony Pictures Animation"
Hotel for Dogs,14,"DreamWorks SKG,  Nickelodeon Movies"
House of 1000 Corpses,21,"Universal Pictures,  Spectacle Entertainment Group"
House of Wax,12," Dark Castle Entertainment,  Warner Bros., Village Roadshow Pictures"
House of the Dead,17," Brightlight Pictures,  Herold Productions, Boll Kino Beteiligungs GmbH & Co. KG,  Mindfire Entertainment"
How Do You Know,15,"Columbia Pictures,  Gracie Films,  Road Rebel"
How High,8," Native Pictures Productions,  Jersey Films, Universal Pictures"
How the Grinch Stole Christmas,30,"Imagine Entertainment,  Universal Pictures"
How to Lose Friends & Alienate People,37," Film4,  Aramid Entertainment Fund, UK Film Council,  Intandem Films,  Lipsync Productions"
How to Lose a Guy in 10 Days,28,Paramount Pictures
How to Train Your Dragon,24," Mad Hatter Entertainment,  Vertigo Entertainment, DreamWorks Animation"
How to Train Your Dragon 2,26,"DreamWorks Animation,  Mad Hatter Entertainment"
Hugo,4," Infinitum Nihil, Paramount Pictures,  GK Films"
Hulk,4," Marvel Enterprises,  Valhalla Motion Pictures,  Good Machine, Universal Pictures"
Hustle & Flow,13,MTV Films
I Am Legend,11," Original Film,  Weed Road Pictures,  Heyday Films,  Warner Bros., Village Roadshow Pictures"
I Am Number Four,16," Touchstone Pictures,  Reliance BIG Entertainment, DreamWorks SKG,  Bay Films"
I Am Sam,8,New Line Cinema
I Could Never Be Your Woman,27,"Scott Rudin Productions,  Bauer Martinez Studios,  I Could Never Ltd."
I Don't Know How She Does It,28,The Weinstein Company
I Know Who Killed Me,20," 360 Pictures, TriStar Pictures"
I Love You Phillip Morris,25,EuropaCorp
"I Love You, Man",15," The Montecito Picture Company, DreamWorks SKG,  Bernard Gayle Productions,  De Line Pictures"
I Now Pronounce You Chuck & Larry,33,"Universal Pictures,  Happy Madison Productions"
I Spy,5,Colombia Pictures
I Think I Love My Wife,22,Fox Searchlight Pictures
I'm Not There.,14," Dreamachine, Endgame Entertainment,  John Wells Productions,  Rising Star,  Killer Films"
"I, Frankenstein",15," Lionsgate,  Sidney Kimmel Entertainment, Lakeshore Entertainment,  Hopscotch Films"
"I, Robot",8,"Twentieth Century Fox Film Corporation,  Mediastream Vierte Film GmbH & Co. Vermarktungs KG,  Davis Entertainment,  Laurence Mark Productions,  Overbrook Entertainment"
Ice Age,7," Twentieth Century Fox Animation, Twentieth Century Fox Film Corporation,  Blue Sky Studios"
Ice Age: Continental Drift,26," Twentieth Century Fox Animation, Blue Sky Studios"
Ice Age: The Meltdown,21," Twentieth Century Fox Animation, Blue Sky Studios"
Identity,8,"Konrad Pictures,  Columbia Pictures Corporation"
Identity Thief,14," Aggregate Films,  DumbDumb, Stuber Productions"
If I Stay,9," Metro-Goldwyn-Mayer (MGM), New Line Cinema"
Igby Goes Down,14,United Artists
Igor,4,"Exodus Film Group,  Exodus Productions"
Immortals,9,"Virgin Produced,  Mark Canton Productions"
In Bruges,9," Scion Films,  Focus Features,  Twins Financing,  Film4, Blueprint Pictures"
In Time,7,"Regency Enterprises,  Strike Entertainment,  New Regency Pictures"
In the Heart of the Sea,23," Spring Creek Productions,  Warner Bros.,  Roth Films,  K. JAM Media, Imagine Entertainment"
In the Land of Women,20," Anonymous Content, Castle Rock Entertainment,  Land Films Inc."
In the Valley of Elah,21," Blackfriars Bridge Films,  NALA Films, Summit Entertainment,  Samuels Media,  Warner Independent Pictures (WIP)"
Inception,9,"Legendary Pictures,  Syncopy,  Warner Bros."
Indiana Jones and the Kingdom of the Crystal Skull,50,"Lucasfilm,  Paramount Pictures"
Indigènes,10,Tessalit Productions
Inglourious Basterds,20,"Universal Pictures,  A Band Apart,  Visiona Romantica,  Zehnte Babelsberg"
Inherent Vice,13,"Ghoulardi Film Company,  Warner Bros."
Inkheart,8,"New Line Cinema,  Internationale Filmproduktion Blackbird Erste"
Inside Man,10,"Imagine Entertainment,  Universal Pictures"
Inside Out,10,"Walt Disney Pictures,  Walt Disney Studios Motion Pictures,  Pixar Animation Studios"
Insidious: Chapter 3,20,Sony Pictures
Insomnia,8," Alcon Entertainment, Section Eight,  Witt/Thomas Productions"
Insurgent,9," Red Wagon Entertainment,  NeoReel,  Mandeville Films, Summit Entertainment"
Interstellar,12," Lynda Obst Productions,  Syncopy,  Warner Bros., Paramount Pictures,  Legendary Pictures"
Into the Blue,13," Mandalay Pictures,  Metro-Goldwyn-Mayer (MGM), Columbia Pictures Corporation"
Into the Storm,14," Village Roadshow Pictures,  Broken Road Productions, New Line Cinema"
Into the Wild,13," Art Linson Productions,  Into the Wild, Paramount Vantage,  River Road Entertainment"
Into the Woods,14," Marc Platt Productions,  Lucamar Productions, Walt Disney Pictures"
Intolerable Cruelty,19," Mike Zoss Productions, Imagine Entertainment,  Universal Pictures,  Alphaville Productions"
Invictus,8,"Spyglass Entertainment,  Revelations Entertainment,  Warner Bros.,  Mace Neufeld Productions,  Malpaso Productions"
Iron Man,8,Marvel Studios
Iron Man 2,10,Marvel Studios
Iron Man 3,10,Marvel Studios
It's Complicated,16,"Universal Pictures,  Waverly Films,  Scott Rudin Productions,  Relativity Media,  Dentsu"
It’s a Boy Girl Thing,23,"Prospero Pictures,  Scion Films,  Alliance Atlantis Motion Picture Production,  Rocket Pictures,  Icon Entertainment International"
J. Edgar,8," Malpaso Productions,  Wintergreen Productions, Imagine Entertainment"
Jack Reacher,12," Skydance Productions, Paramount Pictures,  TC Productions,  Mutual Film Company"
Jack Ryan: Shadow Recruit,25," Mace Neufeld Productions,  Etalon film, Paramount Pictures,  Skydance Productions,  Di Bonaventura Pictures"
Jack and Jill,13,"Columbia Pictures,  Broken Road Productions,  Happy Madison Productions"
Jack the Giant Slayer,21," Big Kid Pictures,  Legendary Pictures, New Line Cinema,  Warner Bros.,  Original Film"
Jackass Number Two,18,Paramount Pictures
Jackass Presents: Bad Grandpa,29," Dickhouse Productions,  MTV Films, Paramount Pictures"
Jackass: The Movie,18,Paramount Pictures
Jarhead,7,"Universal Pictures,  Motion Picture KAPPA Produktionsgesellschaft,  Neal Street Productions,  Red Wagon Entertainment"
Jason X,7,"New Line Cinema,  Crystal Lake Entertainment,  Sean S. Cunningham Films"
Jay and Silent Bob Strike Back,30," Miramax,  View Askew Productions, Dimension Films"
Jeepers Creepers,16," American Zoetrope, United Artists,  Cinerenta-Cinebeta,  VCL Communications,  Cinerenta Medienbeteiligungs KG"
Jeepers Creepers 2,18," American Zoetrope, United Artists,  Jeepers Creepers II,  Myriad Pictures"
"Jeff, Who Lives at Home",23,Indian Paintbrush
Jem and the Holograms,21,"Universal Pictures,  Blumhouse Productions,  Allspark Pictures,  Hasbro Studios"
Jennifer's Body,15,"Dune Entertainment,  Fox Atomic"
Ji jie hao,10,Huayi Brothers Media Corporation
Jimmy Neutron: Boy Genius,25," Paramount Animation,  Universal Cartoon Studios, Nickelodeon Movies"
Jobs,4,"Open Road Films,  Silver Reel,  Dillywood,  Five Star Institute"
Joe Dirt,8,"Columbia Pictures,  Happy Madison Productions"
John Carter,11,Walt Disney Pictures
John Q,6," Evolution Entertainment, New Line Cinema,  Burg/Koules Productions"
John Tucker Must Die,20," Dune Entertainment,  Landscape Entertainment, Twentieth Century Fox Film Corporation,  John US Productions,  Major Studio Partners"
John Wick,9," MJW Films,  Warner Bros.,  87Eleven,  DefyNite Films, Thunder Road Pictures"
Johnny English,14," StudioCanal, Universal Pictures"
Johnny English Reborn,21,Universal Pictures
Johnson Family Vacation,23," Bird and a Bear Entertainment,  Catch Productions,  Hallway Pictures, Fox Searchlight Pictures"
Jonah Hex,9,Warner Bros.
Journey 2: The Mysterious Island,32," Walden Media, New Line Cinema,  Contrafilm"
Journey to the Center of the Earth,34," Walden Media, New Line Cinema"
Joy Ride,8,"Regency Enterprises,  LivePlanet,  New Regency Pictures,  Bad Robot,  Epsilon Motion Pictures"
Julie & Julia,13," Easy There Tiger Productions, Columbia Pictures,  Scott Rudin Productions"
Jumper,6,"Dune Entertainment,  New Regency Pictures,  Hypnotic"
Jumping the Broom,17," TDJ Enterprises / New Dimensions Entertainment, TriStar Pictures,  Sony Pictures Worldwide Acquisitions (SPWA),  Our Stories Films,  Stage 6 Films"
Juno,4," Mandate Pictures, Fox Searchlight Pictures"
Jupiter Ascending,17," Anarchos Productions,  Dune Entertainment,  Warner Bros., Village Roadshow Pictures"
Jurassic Park III,17," Amblin Entertainment, Universal Studios"
Jurassic World,14," Amblin Entertainment,  Fuji Television Network,  Dentsu,  Legendary Pictures, Universal Studios"
Just Go With It,15," Happy Madison Productions, Columbia Pictures"
Just Like Heaven,16,"DreamWorks SKG,  MacDonald/Parkes Productions"
Just Married,12," Robert Simonds Productions, Twentieth Century Fox Film Corporation,  Mediastream Dritte Film GmbH & Co. Beteiligungs KG"
Just My Luck,12," New Regency Pictures, Regency Enterprises,  Cheyenne Enterprises"
Justin Bieber: Never Say Never,30," Scooter Braun Films,  Magical Elves Productions, Insurge Pictures"
K-19: The Widowmaker,20," Intermedia Films, Paramount Pictures,  New Regency Pictures,  National Geographic Society,  Palomar Pictures (II)"
K-PAX,5," Lawrence Gordon Productions, Intermedia Films,  IMF Internationale Medien und Film GmbH & Co. 3. Produktions KG,  Pathé Pictures International"
Katy Perry: Part of Me,22,"Paramount Pictures,  MTV Films,  Insurge Pictures,  Imagine Entertainment"
Keeping the Faith,17," Triple Threat Talent,  Touchstone Pictures, Spyglass Entertainment"
Khumba,6,Triggerfish Animation
Kick-Ass,8,Lions Gate
Kicking & Screaming,19,Universal Pictures
Kill Bill: Vol. 1,17," Super Cool ManChu, Miramax Films,  A Band Apart"
Kill Bill: Vol. 2,17," A Band Apart,  Super Cool ManChu, Miramax Films"
Kill the Messenger,18," Bluegrass Films, The Combine"
Killer Elite,12," International Traders,  Ambience Entertainment,  Open Road Films, Current Entertainment,  Omnilab Media"
Killer Joe,10," Picture Perfect (I), Voltage pictures,  ANA Media,  Worldview Entertainment"
Killers,7," Lionsgate,  Aversano Films, Katalyst Films"
Killing Them Softly,19," Inferno Entertainment,  1984 Private Defense Contractors, Plan B Entertainment,  Annapurna Pictures,  Chockstone Pictures"
King Arthur,11,"Jerry Bruckheimer Films,  World 2000 Entertainment,  Green Hills Productions,  Touchstone Pictures"
King Kong,9," MFPV Film, WingNut Films,  Big Primate Pictures,  Universal Pictures"
Kingdom of Heaven,17," Dune Films,  Scott Free Productions,  Kanzaman, Studio Babelsberg,  Twentieth Century Fox Film Corporation"
Kingsman: The Secret Service,28," Marv Films, Twentieth Century Fox Film Corporation,  Cloudy Productions,  TSG Entertainment"
Kiss of the Dragon,18," Immortal Entertainment, Twentieth Century Fox Film Corporation,  Current Entertainment,  Canal+,  EuropaCorp"
Knight and Day,14," Pink Machine, Tree Line Films,  Regency Enterprises,  Twentieth Century Fox Film Corporation,  Dune Entertainment"
Knockaround Guys,16,Lawrence Bender Productions
Knocked Up,10," Apatow Productions, Universal Pictures"
Knowing,7," Escape Artists, Summit Entertainment,  Goldcrest Pictures,  Mystery Clock Cinema,  Kaplan/Perrone Entertainment"
Krampus,7," Legendary Pictures, Universal Pictures"
Kung Fu Panda,13,DreamWorks Animation
Kung Fu Panda 2,15,DreamWorks Animation
La migliore offerta,19," Friuli Venezia Giulia Film Commission, Paco Cinematografica,  Regione Lazio,  Warner Bros.,  Business Location Sudtirol Alto Adige"
Ladder 49,9," Beacon Communications,  Fantail Films Inc.,  Touchstone Pictures, Casey Silver Productions,  Beacon Pictures"
Lady in the Water,17,"Legendary Pictures,  Blinding Edge Pictures,  Warner Bros."
Lakeview Terrace,16," Overbrook Entertainment, Screen Gems"
Land of the Dead,16," Exception Wild Bunch, Universal Pictures,  Atmosphere Entertainment MM,  Romero-Grunwald Productions"
Land of the Lost,16," Mosaic Media Group, Universal Pictures,  Sid & Marty Krofft Pictures,  Relativity Media"
Lara Croft Tomb Raider: The Cradle of Life,42,"Paramount Pictures,  Toho-Towa,  Lawrence Gordon Productions,  Mutual Film Company,  British Broadcasting Corporation (BBC)"
Lara Croft: Tomb Raider,23," Toho-Towa,  Lawrence Gordon Productions, Paramount Pictures,  British Broadcasting Corporation (BBC),  Mutual Film Company"
Larry Crowne,12," Playtone Productions,  Vendome Pictures, Universal Pictures"
Last Holiday,12,Paramount Pictures
Last Vegas,10," CBS Films,  Gidden Media, Laurence Mark Productions,  Outlaw Sinema,  Good Universe"
Law Abiding Citizen,19,"Film Department,  The,  Evil Twins,  Warp Films"
Lawless,7," Yucaipa Films,  Benaroya Pictures,  Annapurna Pictures, The Weinstein Company,  Pie Films Inc."
Leap Year,9," BenderSpink,  Birnbaum/Barber,  Octagon Films,  Spyglass Entertainment, Universal Pictures"
Left Behind,11,Stoney Lake Entertainment
Legally Blonde,14,"Marc Platt Productions,  Metro-Goldwyn-Mayer (MGM)"
"Legally Blonde 2: Red, White & Blonde",37," Metro-Goldwyn-Mayer (MGM), Type A Films,  Marc Platt Productions"
Legend,6,"Working Title Films,  Anton Capital Entertainment (ACE),  Cross Creek Pictures"
Legend of the Guardians: The Owls of Ga'Hoole,45," Animal Logic,  Cruel and Unusual Films,  Warner Bros., Village Roadshow Pictures"
Legends of Oz: Dorothy's Return,31,"Prana Animation Studios,  Summertime Entertainment"
Legion,6,Bold Films
Lemony Snicket's A Series of Unfortunate Events,47," Scott Rudin Productions,  DreamWorks Pictures,  Nickelodeon Movies, Paramount Pictures,  Kumar Mobiliengesellschaft mbH & Co. Projekt Nr. 2 KG"
Les Misérables,15," CAMERON MACKINTOSH,  Relativity Media,  Working Title Films, Universal Pictures"
Let Me In,9," Exclusive Media Group,  Overture Films, Hammer Film Productions,  EFTI"
Let's Be Cops,13," WideAwake,  Genre Films, Twentieth Century Fox Film Corporation"
Letters from Iwo Jima,21," Malpaso Productions,  Warner Bros.,  Amblin Entertainment, DreamWorks SKG"
License to Wed,14,"Village Roadshow Pictures,  Phoenix Pictures,  Warner Bros. Pictures,  Underground,  Robert Simonds Productions"
Life as We Know It,18," Gold Circle Films,  Village Roadshow Pictures Asia, Josephson Entertainment"
Life of Pi,10," Dune Entertainment, Ingenious Film Partners,  Fox 2000 Pictures,  Big Screen Productions,  Ingenious Media"
Lilo & Stitch,13," Walt Disney Feature Animation, Walt Disney Pictures"
Limitless,9,"Rogue Pictures,  Relativity Media,  Boy of the Year,  Many Rivers Productions,  Virgin Produced"
Lions for Lambs,15," Wildwood Enterprises, Cruise/Wagner Productions,  United Artists,  Metro-Goldwyn-Mayer (MGM),  Andell Entertainment"
Little Black Book,17,"Revolution Studios,  Blue Star Pictures"
Little Boy,10,Metanoia Films
Little Fockers,14," Universal Pictures,  Relativity Media,  Dreamworks Pictures,  Everyman Pictures, Paramount Pictures"
Little Man,10,"Revolution Studios,  Wayans Bros. Entertainment"
Little Miss Sunshine,20,"Fox Searchlight Pictures,  Bona Fide Productions,  Big Beach Films"
Live Free or Die Hard,21," Dune Entertainment,  Cheyenne Enterprises,  Wintergreen Productions,  Twentieth Century Fox Film Corporation, Ingenious Film Partners"
Lo imposible,12," Apaches Entertainment, Summit Entertainment,  Canal+ España,  Instituto de la Cinematografía y de las Artes Audiovisuales (ICAA),  Telecinco Cinema"
Lockout,7," Ciné+, Canal+,  EuropaCorp"
London Boulevard,16," Projection Pictures, GK Films,  Henceforth,  London Boulevard"
Lone Survivor,13,"Universal Pictures,  Leverage Management,  Weed Road Pictures,  Herrick Entertainment,  Closest to the Hole Productions"
Looney Tunes: Back in Action,28," Warner Bros., Lonely Film Productions GmbH & Co. KG.,  Baltimore Spring Creek Productions,  Warner Bros. Animation,  Goldmann Pictures"
Looper,6," Ram Bergman Productions,  FilmDistrict,  DMG Entertainment, Endgame Entertainment"
Lord of War,11," Rising Star, Saturn Films,  Entertainment Manufacturing Company,  Endgame Entertainment,  Ascendant Pictures"
Lords of Dogtown,16," TriStar Pictures, Columbia Pictures"
Love & Basketball,17,40 Acres & A Mule Filmworks
Love & Other Drugs,18," Stuber Productions,  Fox 2000 Pictures,  Dune Entertainment, Bedford Falls Productions,  Regency Enterprises"
Love Actually,13,DNA Films
Love Happens,12," Relativity Media,  Camp / Thompson Pictures, Universal Pictures,  Scion Films,  Stuber Productions"
Love in the Time of Cholera,27,"New Line Cinema,  Grosvenor Park Media Ltd."
Love the Coopers,16," Groundswell Productions, Imagine Entertainment,  CBS Films"
Lucky Number Slevin,19,"The Weinstein Company,  VIP Medienfonds 4,  FilmEngine,  Ascendant Pictures,  Capitol Films"
Lucy,4," TF1 Films Production,  Canal+,  Ciné+,  EuropaCorp, Universal Pictures"
MacGruber,9,Relativity Media
Machete,7," Overnight Films,  Troublemaker Studios,  Dune Entertainment III, Dune Entertainment"
Machete Kills,13,"Open Road Films,  Aldamisa Entertainment,  Overnight Films,  Demarest Films,  AR Films"
Machine Gun Preacher,20,"Mpower Pictures,  Relativity Media,  1984 Private Defense Contractors,  Moonlighting Films,  Virgin Produced"
Mad Max: Fury Road,18," Kennedy Miller Productions, Village Roadshow Pictures"
Madagascar,10," Pacific Data Images (PDI), DreamWorks SKG,  DreamWorks Animation"
Madagascar 3: Europe's Most Wanted,34,DreamWorks Animation
Madagascar: Escape 2 Africa,27,DreamWorks Animation
Made of Honor,13," Original Film, Columbia Pictures"
Magic Mike,10,"Nick Wechsler Productions,  Extension 765"
Magic Mike XXL,14," Iron Horse Entertainment (II), Warner Bros."
Maid in Manhattan,17," Shoelace Productions, Columbia Pictures,  Revolution Studios,  Hughes Entertainment"
Maleficent,10,"Walt Disney Pictures,  Roth Films"
Mama,4,"Universal Pictures,  Toma 78,  De Milo"
Mamma Mia!,10," Littlestar,  Playtone,  Relativity Media, Universal Pictures,  Internationale Filmproduktion Richter"
Man of Steel,12," Warner Bros.,  Syncopy,  DC Entertainment, Legendary Pictures,  Cruel and Unusual Films"
Man of Tai Chi,14," Company Films,  Dalian Wanda Group, Universal Pictures,  Village Roadshow Pictures,  China Film Group Corporation (CFGC)"
Man of the Year,15," Morgan Creek Productions, Universal Pictures"
Man on Fire,11," New Regency Pictures,  Epsilon Motion Pictures,  Fox 2000 Pictures, Regency Enterprises,  Scott Free Productions"
Man on a Ledge,14," Di Bonaventura Picture, Summit Entertainment"
Mandela: Long Walk to Freedom,29,"Distant Horizons,  Videovision Entertainment,  Origin Pictures,  Film Afrika Worldwide,  Pathe"
Mao's Last Dancer,17,Great Scott Productions Pty. Ltd.
Marie Antoinette,16," Pricel, American Zoetrope,  Tohokushinsha Film,  Commission du Film France,  Columbia Pictures Corporation"
Marley & Me,11," Dune Entertainment III, Sunswept Entertainment"
Marmaduke,9,Twentieth Century Fox Film Corporation
Mars Needs Moms,15,Walt Disney Animation Studios
Master and Commander: The Far Side of the World,47," Miramax,  Samuel Goldwyn Films, Universal Pictures,  Twentieth Century Fox Film Corporation"
Match Point,11,DreamWorks
Max,3," Metro-Goldwyn-Mayer (MGM),  Warner Bros., Sunswept Entertainment"
Max Keeble's Big Move,21," Karz Entertainment, Walt Disney Pictures"
Max Payne,9," Firm Films,  Abandon Entertainment, Dune Entertainment,  Foxtor Productions,  Collision Entertainment"
Maze Runner: The Scorch Trials,30,"Gotham Group,  Temple Hill Entertainment,  TSG Entertainment"
Me and Orson Welles,19," Freestyle Releasing, Isle of Man Film,  CinemaNX"
"Me, Myself & Irene",18," Conundrum Entertainment, Twentieth Century Fox Film Corporation"
Mean Girls,10,Paramount Pictures
Meet Dave,9," Deep River Productions,  Guy Walks into a Bar Productions, 20th Century Fox,  Regency Enterprises"
Meet the Fockers,16," Everyman Pictures,  Universal Pictures,  Tribeca Productions, DreamWorks SKG"
Meet the Parents,16," Tribeca Productions,  Nancy Tenenbaum Films,  Universal Pictures, DreamWorks SKG"
Meet the Robinsons,18," Walt Disney Animation Studios, Walt Disney Pictures"
Meet the Spartans,17,"Regency Enterprises,  New Regency Pictures"
Megamind,8,DreamWorks Animation
Memento,7," Team Todd, Summit Entertainment,  I Remember Productions,  Newmarket Capital Group"
Memoirs of a Geisha,19," Columbia Pictures Corporation, DreamWorks SKG,  Spyglass Entertainment,  Red Wagon Productions"
Men in Black 3,14,"Amblin Entertainment,  Imagenation Abu Dhabi FZ,  Media Magik Entertainment,  Parkes/MacDonald Productions,  Hemisphere Media Capital"
Men in Black II,15,"Columbia Pictures,  Parkes+MacDonald Image Nation,  Amblin Entertainment,  Columbia Pictures Corporation"
Men of Honor,12,Fox 2000 Pictures
Metallica: Through the Never,28," Picturehouse Entertainment, Exclusive Media Group"
